{
  "version": 1,
  "id": "pe-095",
  "title": "Generated Level 95",
  "difficulty": 3,
  "grid": {
    "width": 6,
    "height": 6,
    "vehicles": [
      {
        "id": "hero",
        "type": "hero",
        "x": 0,
        "y": 2,
        "width": 2,
        "height": 1,
        "orientation": "horizontal",
        "color": "#E74C3C"
      },
      {
        "id": "v0",
        "type": "truck",
        "x": 3,
        "y": 3,
        "width": 3,
        "height": 1,
        "orientation": "horizontal",
        "color": "#E74C3C"
      },
      {
        "id": "v1",
        "type": "truck",
        "x": 4,
        "y": 0,
        "width": 1,
        "height": 3,
        "orientation": "vertical",
        "color": "#3498DB"
      },
      {
        "id": "v2",
        "type": "truck",
        "x": 1,
        "y": 3,
        "width": 1,
        "height": 3,
        "orientation": "vertical",
        "color": "#2ECC71"
      },
      {
        "id": "v3",
        "type": "car",
        "x": 5,
        "y": 0,
        "width": 1,
        "height": 2,
        "orientation": "vertical",
        "color": "#F39C12"
      },
      {
        "id": "v4",
        "type": "truck",
        "x": 0,
        "y": 3,
        "width": 1,
        "height": 3,
        "orientation": "vertical",
        "color": "#9B59B6"
      }
    ],
    "exit": {
      "x": 6,
      "y": 2,
      "direction": "right"
    }
  },
  "targetMoves": 4,
  "maxMoves": 50
}
