{
  "id": "pe-004",
  "difficulty": 1,
  "targetMoves": 4,
  "grid": {
    "width": 6,
    "height": 6,
    "vehicles": [
      {
        "id": "h",
        "type": "hero",
        "x": 0,
        "y": 2,
        "width": 2,
        "height": 1,
        "orientation": "horizontal"
      },
      {
        "id": "a",
        "type": "car",
        "x": 2,
        "y": 1,
        "width": 1,
        "height": 2,
        "orientation": "vertical"
      },
      {
        "id": "b",
        "type": "car",
        "x": 4,
        "y": 1,
        "width": 1,
        "height": 2,
        "orientation": "vertical"
      },
      {
        "id": "c",
        "type": "car",
        "x": 0,
        "y": 0,
        "width": 2,
        "height": 1,
        "orientation": "horizontal"
      }
    ],
    "exit": {
      "x": 5,
      "y": 2,
      "direction": "right"
    }
  }
}
