{
  "id": "pe-017",
  "difficulty": 6,
  "targetMoves": 12,
  "grid": {
    "width": 6,
    "height": 6,
    "vehicles": [
      {
        "id": "h",
        "type": "hero",
        "x": 0,
        "y": 2,
        "width": 2,
        "height": 1,
        "orientation": "horizontal"
      },
      {
        "id": "a",
        "type": "truck",
        "x": 2,
        "y": 0,
        "width": 1,
        "height": 3,
        "orientation": "vertical"
      },
      {
        "id": "b",
        "type": "car",
        "x": 4,
        "y": 2,
        "width": 1,
        "height": 2,
        "orientation": "vertical"
      },
      {
        "id": "c",
        "type": "car",
        "x": 0,
        "y": 0,
        "width": 2,
        "height": 1,
        "orientation": "horizontal"
      },
      {
        "id": "d",
        "type": "car",
        "x": 3,
        "y": 0,
        "width": 2,
        "height": 1,
        "orientation": "horizontal"
      },
      {
        "id": "e",
        "type": "car",
        "x": 3,
        "y": 4,
        "width": 2,
        "height": 1,
        "orientation": "horizontal"
      },
      {
        "id": "f",
        "type": "car",
        "x": 0,
        "y": 4,
        "width": 2,
        "height": 1,
        "orientation": "horizontal"
      },
      {
        "id": "g",
        "type": "car",
        "x": 0,
        "y": 3,
        "width": 2,
        "height": 1,
        "orientation": "horizontal"
      }
    ],
    "exit": {
      "x": 5,
      "y": 2,
      "direction": "right"
    }
  }
}
